customer_id,derived_pool,assigned_variant,email_subject,email_body
C0064,unknown,urgency,"don't miss out on your merino socks, makayla","hi makayla, we noticed you left our merino socks in your cart. please note that we can't hold items in cart for an extended period. if you're still interested, we recommend completing your purchase soon to ensure availability. [Complete Your Purchase] — The Hazel Apparel Team"
C0065,evening_workday,seasonal_discount,"don't let winter chill get the best of you, elijah","as winter sets in, we want to help you stay warm with our cozy collection. you left the beanie hat and long sleeve thermal in your cart, and we're offering 20% off these items for the next 48 hours. take advantage of this limited time offer to bundle up and save. [Complete Your Purchase] — The Hazel Apparel Team"
C0066,weekend_noon,seasonal_discount,"don't let winter slip away, amelia","amelia, as winter sets in, we want to help you stay warm and cozy. you left our fleece lined jacket in your cart, and we're offering 20% off for the next 48 hours. this is a great chance to complete your winter look. the offer will expire soon, so take a moment to revisit your cart. [Complete Your Purchase] — The Hazel Apparel Team"
C0067,evening_workday,seasonal_discount,"Don't let winter slip away, Kennedy","As the snow falls gently outside, we're reminded that winter's chilliest moments are also its most magical. You had your eye on our Parka Coat, a staple of our winter collection. For a limited time, we're offering 20% off your entire purchase, but only for the next 48 hours. This is a rare chance to stay warm and stylish at a special price. [Complete Your Purchase] — The Hazel Apparel Team"
C0068,evening_workday,urgency,"Don't miss out on your Warm Fleece Socks, William","William, we noticed you left the Warm Fleece Socks in your cart. As we're nearing the end of the season, our stock is becoming limited. If you're still interested, we recommend completing your purchase soon, as we can't hold items in carts for an extended period. [Complete Your Purchase] — The Hazel Apparel Team"
C0069,evening_workday,urgency,"Your Cart is About to Expire, Alyssa","Hi Alyssa, we noticed you left the Parka Coat and Ski Pants in your cart. These popular items won't be held for long. If you're still interested, please complete your purchase soon to ensure availability. We can't guarantee they'll be in stock if you come back later. [Complete Your Purchase] — The Hazel Apparel Team"
C0070,unknown,personalized_rec,"finish your winter wardrobe, noah","noah, you were close to completing your winter look with the shearling boots, waterproof gloves, and fleece lined sweater. hundreds of customers love these items, with the boots rated 4.6/5 by 321 customers, the gloves 4.3/5 by 231, and the sweater 4.4/5 by 201. they're popular for a reason - warmth, quality, and style. [Complete Your Purchase] — The Hazel Apparel Team"
C0071,evening_workday,urgency,"Caleb, don't miss out on your Warm Fleece Socks","Caleb, we noticed you left the Warm Fleece Socks in your cart. As we're approaching peak season, our inventory is moving quickly. If you're still interested, we recommend completing your purchase soon, as we can't hold items in carts indefinitely. [Complete Your Purchase] — The Hazel Apparel Team"
C0072,evening_workday,seasonal_discount,"don't miss out on winter warmth, kayla","as winter sets in, we want to help you stay cozy. you left our parka coat in your cart, and we're offering 20% off for the next 48 hours. this is a great chance to elevate your winter wardrobe. the offer will expire soon, so take a moment to revisit your cart. [Complete Your Purchase] — The Hazel Apparel Team"
C0073,unknown,seasonal_discount,"don't let winter slip away, kevin","as winter sets in, we want to help you stay warm and cozy. you left the snow pants and cable knit hat in your cart, and we're offering 20% off these items for the next 48 hours. take advantage of this limited time offer to elevate your winter wardrobe. [Complete Your Purchase] — The Hazel Apparel Team"
C0074,evening_workday,seasonal_discount,"don't let winter slip away, harper","harper, as winter sets in, we want to help you stay warm and cozy. you left our waterproof gloves in your cart, a perfect addition to your winter collection. for a limited time, we're offering 20% off your purchase, but only for the next 48 hours. take advantage of this offer before it's gone. [Complete Your Purchase] — The Hazel Apparel Team"
C0075,weekend_noon,urgency,"Don't miss out on your Cable Knit Hat and Waterproof Gloves, Brianna","Hi Brianna, we noticed you left the Cable Knit Hat and Waterproof Gloves in your cart. These items are in high demand and we can't hold them for much longer. If you're still interested, please come back and complete your purchase before they're gone. [Complete Your Purchase] — The Hazel Apparel Team"
C0076,evening_workday,personalized_rec,"Finish your purchase, Gage","Hi Gage, you left the Trench Coat in your cart, a favorite among our customers with a 4.5-star rating from 421 reviews. They love its warmth and style, and we think you will too. Many have chosen it for their winter wardrobe, and we're sure you'll appreciate its quality. Come back and complete your purchase: [Complete Your Purchase] — The Hazel Apparel Team"
C0077,unknown,personalized_rec,"Finish your order, Margaret","Margaret, it looks like you left the Long Sleeve Thermal in your cart. This top has been rated 4.6/5 by 189 customers, who love its warmth and comfort. Many of our customers have made it a winter staple. You're likely to love it just as much. [Complete Your Purchase] — The Hazel Apparel Team"
C0078,evening_workday,urgency,don't miss out on your mountain jacket and warm fleece socks,"hi Ronan, we noticed you left the Mountain Jacket and Warm Fleece Socks in your cart. these items are still available, but we can't hold them for much longer. if you're still interested, please come back and complete your purchase before they're gone. [Complete Your Purchase] — The Hazel Apparel Team"
C0079,evening_workday,personalized_rec,"you left something behind, jasmine","Jasmine, it looks like you left the Fleece Lined Sweater and Fleece Lined Jacket in your cart. Hundreds of customers have given these a try, with the sweater rated 4.4/5 by 201 customers and the jacket rated 4.6/5 by 312 customers. They love the warmth and comfort they provide. You're likely to love them just as much. [Complete Your Purchase] — The Hazel Apparel Team"
C0080,unknown,personalized_rec,"you left something behind, michael","Michael, it looks like you left the Warm Fleece Socks, Thermal Insulated Boots, and Parka Coat in your cart. These are some of our most loved items, with the socks rated 4.4/5 by 120 customers, the boots rated 4.5/5 by 421 customers, and the coat rated 4.4/5 by 351 customers. They love them for their warmth and quality. Come back and see why they're favorites. [Complete Your Purchase]
— The Hazel Apparel Team"
C0081,weekend_noon,urgency,"Don't miss out on your Merino Socks, Brayden","Hi Brayden, we noticed you left a pair of Merino Socks in your cart. Our inventory is updating soon and we can't hold items in carts indefinitely. If you're still interested, we recommend completing your purchase before the item becomes unavailable. [Complete Your Purchase] — The Hazel Apparel Team"
C0082,evening_workday,urgency,your base layer thermal is still waiting,"hi Joshua, we noticed you left a Base Layer Thermal in your cart. it's a popular item and we can't hold it for much longer. if you're still interested, please come back and complete your purchase before it's gone. — The Hazel Apparel Team [Complete Your Purchase]"
C0083,unknown,urgency,"Zoe, don't miss out on your Merino Socks","Hi Zoe, we noticed you left your Merino Socks in your cart. As we're approaching the peak winter season, our inventory is moving quickly. We can't hold your item for much longer, so please come back and complete your purchase before it's gone. [Complete Your Purchase] — The Hazel Apparel Team"
C0084,evening_workday,urgency,don't miss out on your cashmere sweater and down filled coat,"hi Lily, we noticed you left a cashmere sweater and a down filled coat in your cart. please be aware that these items are in high demand and may not be held for much longer. if you're still interested, we recommend completing your purchase soon to avoid missing out. [Complete Your Purchase] — The Hazel Apparel Team"
C0085,unknown,seasonal_discount,"don't let winter slip away, ava","as winter sets in, we want to make sure you're cozy in our Ski Pants and Base Layer Thermal. for a limited time, we're offering 20% off your entire cart. this offer will expire in 48 hours, so take a moment to come back and complete your purchase before it's gone. [Complete Your Purchase] — The Hazel Apparel Team"
C0086,weekend_noon,personalized_rec,"you left something behind, trevor","Trevor, it looks like you left the Ski Pants, rated 4.8/5 by 701 customers, and the Touchscreen Gloves, rated 4.4/5 by 250 customers, in your cart. Our customers love these items for their exceptional quality and performance. The Ski Pants are a favorite for their warmth and comfort, while the Touchscreen Gloves are praised for their functionality. [Complete Your Purchase]
— The Hazel Apparel Team"
C0087,unknown,personalized_rec,"you left something behind, nixon","hi nixon, it looks like you left the shearling boots in your cart. with a 4.6/5 rating from 321 customers, it's clear why this style is a favorite - the shearling lining and rugged sole make it a must-have for winter. many of our customers have fallen in love with this boot for its warmth and durability. [Complete Your Purchase] — The Hazel Apparel Team"
C0088,unknown,seasonal_discount,"don't let winter slip away, cameron","hi cameron, as winter sets in, we wanted to remind you about the warm fleece socks and winter parka waiting in your cart. for a limited time, you can get 20% off these essentials from our winter collection. this offer expires in 48 hours, so take a moment to come back and complete your purchase before it's gone. [Complete Your Purchase] — The Hazel Apparel Team"
C0089,weekend_noon,seasonal_discount,"don't let winter slip away, cortez","hi cortez, as winter sets in, we want to help you stay warm and stylish. you left the shearling boots in your cart, and we're offering 20% off for a limited time. this offer expires in 48 hours, so take a moment to complete your purchase before it's gone. [Complete Your Purchase] — The Hazel Apparel Team"
C0090,unknown,urgency,"Your cart is about to expire, Parker","Parker, we noticed you left some items in your cart, including the Down Filled Coat, Touchscreen Gloves, and Fleece Lined Sweater. These popular items won't be held for long. If you're still interested, we recommend completing your purchase soon. Our inventory is updating regularly and we can't guarantee availability of these items in your cart. [Complete Your Purchase] — The Hazel Apparel Team"
C0091,unknown,urgency,"don't miss out on your winter essentials, brock","Brock, we noticed you left some items in your cart, including the Cashmere Sweater, Trench Coat, and Faux Fur Scarf. please note that these items are still available, but we can't hold them for much longer. if you're still interested, we recommend completing your purchase soon. [Complete Your Purchase] — The Hazel Apparel Team"
C0092,weekend_noon,seasonal_discount,"don't let winter slip away, myles","as winter sets in, we want to help you stay warm and cozy. you left the parka coat and cashmere sweater in your cart, and we're offering 20% off these items for the next 48 hours. this is a great chance to upgrade your winter wardrobe before the season heats up. [Complete Your Purchase] — The Hazel Apparel Team"
C0093,unknown,seasonal_discount,"Don't let winter slip away, Ashton","As winter sets in, we want to help you stay warm and cozy. You left the Long Sleeve Thermal and Winter Parka in your cart, perfect pieces from our winter collection. For the next 48 hours, you can get 20% off these items. Take advantage of this offer before it expires and complete your winter wardrobe. [Complete Your Purchase] — The Hazel Apparel Team"
C0094,evening_workday,seasonal_discount,"don't let winter slip away, casey","as winter sets in, we want to help you stay warm and cozy. you left the base layer thermal and trest coat in your cart, perfect pieces from our winter collection. for a limited time, we're offering 20% off your entire purchase, but only for the next 48 hours. take advantage of this offer before it's gone. [Complete Your Purchase] — The Hazel Apparel Team"
C0095,evening_workday,personalized_rec,"Don't miss out on your Thermal Insulated Boots, Julian","Julian, it looks like you left something behind. The Thermal Insulated Boots, rated 4.5/5 by 421 customers, are still waiting for you in your cart. Our customers love these boots for their warmth and comfort, and we think you will too. Join the hundreds of satisfied customers who've already made them a winter staple. [Complete Your Purchase] — The Hazel Apparel Team"
C0096,evening_workday,personalized_rec,"You were close to keeping warm, Micah","Micah, you had the Winter Parka, rated 4.8/5 by 512 customers, and the Long Sleeve Thermal, rated 4.6/5 by 189 customers, in your cart. Many of our customers love these items for their exceptional warmth and quality. Others have chosen them for a reason - they're staples for any winter wardrobe. Come back and see why they're so popular. [Complete Your Purchase]
— The Hazel Apparel Team"
C0097,weekend_noon,seasonal_discount,"don't let winter slip away, tatum","as winter sets in, we want to help you stay cozy. you left the fleece lined sweater and long sleeve thermal in your cart, and we're offering 20% off for the next 48 hours. this is a great chance to complete your winter wardrobe. the offer will expire soon, so take a moment to treat yourself. [Complete Your Purchase] — The Hazel Apparel Team"
C0098,evening_workday,urgency,"Your cart is about to expire, Kelsey","Hi Kelsey, we noticed you left the Fleece Lined Sweater and Woven Wool Scarf in your cart. These items are in high demand and may not be held for much longer. If you're still interested, please complete your purchase before they're gone. [Complete Your Purchase] — The Hazel Apparel Team"
C0099,weekend_noon,urgency,"Don't miss out on your Merino Socks, Kylie","Kylie, we noticed you left your Merino Socks in your cart. As we're approaching the peak winter season, our inventory is moving quickly. We can't hold your item for much longer, so please come back to complete your purchase before it's gone. [Complete Your Purchase] — The Hazel Apparel Team"
C0100,evening_workday,seasonal_discount,"don't let winter slip away, anthony","as winter settles in, we want to help you stay warm and cozy. you left our woven wool scarf in your cart, and we're offering 20% off for the next 48 hours. this is a great chance to complete your winter look. the offer will expire soon, so take a moment to treat yourself. [Complete Your Purchase] — The Hazel Apparel Team"
